{
  "kind": "infrawright.transform_resource_cohort",
  "product": "zia",
  "resources": [
    {
      "acknowledged_drops": [],
      "html_unescape_passes": 0,
      "import_id": {
        "segments": [
          {
            "field": "id"
          }
        ],
        "template": "{id}"
      },
      "invert_bool": [],
      "key_fields": [
        "name"
      ],
      "lookup_source": null,
      "projection": {
        "attributes": {
          "admin_acct_access": "string",
          "alerting_access": "string",
          "analysis_access": "string",
          "dashboard_access": "string",
          "device_info_access": "string",
          "ext_feature_permissions": [
            "map",
            "string"
          ],
          "feature_permissions": [
            "map",
            "string"
          ],
          "is_auditor": "bool",
          "is_non_editable": "bool",
          "logs_limit": "string",
          "name": "string",
          "permissions": [
            "set",
            "string"
          ],
          "policy_access": "string",
          "rank": "number",
          "report_access": "string",
          "report_time_duration": "number",
          "role_type": "string",
          "username_access": "string"
        },
        "blocks": {},
        "silently_ignored_attributes": [
          "id"
        ]
      },
      "references": {},
      "renames": {},
      "split_csv": [],
      "type": "zia_admin_roles"
    },
    {
      "acknowledged_drops": [
        "city",
        "last_modification_time",
        "last_modified_by"
      ],
      "html_unescape_passes": 0,
      "import_id": {
        "segments": [
          {
            "field": "id"
          }
        ],
        "template": "{id}"
      },
      "invert_bool": [],
      "key_fields": [
        "ip_address"
      ],
      "lookup_source": null,
      "projection": {
        "attributes": {
          "comment": "string",
          "geo_override": "bool",
          "ip_address": "string",
          "latitude": "number",
          "longitude": "number",
          "routable_ip": "bool"
        },
        "blocks": {},
        "silently_ignored_attributes": [
          "id"
        ]
      },
      "references": {},
      "renames": {},
      "split_csv": [],
      "type": "zia_traffic_forwarding_static_ip"
    },
    {
      "acknowledged_drops": [
        "category_group",
        "id",
        "scopes[].scope_entities.name",
        "scopes[].scope_group_member_entities.name",
        "val"
      ],
      "html_unescape_passes": 0,
      "import_id": {
        "segments": [
          {
            "field": "id"
          }
        ],
        "template": "{id}"
      },
      "invert_bool": [],
      "key_fields": [
        "configured_name"
      ],
      "lookup_source": {
        "name_field": "configured_name"
      },
      "projection": {
        "attributes": {
          "configured_name": "string",
          "custom_category": "bool",
          "custom_ip_ranges_count": "number",
          "custom_urls_count": "number",
          "db_categorized_urls": [
            "set",
            "string"
          ],
          "description": "string",
          "editable": "bool",
          "ip_ranges": [
            "set",
            "string"
          ],
          "ip_ranges_retaining_parent_category": [
            "set",
            "string"
          ],
          "ip_ranges_retaining_parent_category_count": "number",
          "keywords": [
            "set",
            "string"
          ],
          "keywords_retaining_parent_category": [
            "set",
            "string"
          ],
          "regex_patterns": [
            "set",
            "string"
          ],
          "regex_patterns_retaining_parent_category": [
            "set",
            "string"
          ],
          "super_category": "string",
          "type": "string",
          "url_type": "string",
          "urls": [
            "list",
            "string"
          ],
          "urls_retaining_parent_category_count": "number"
        },
        "blocks": {
          "scopes": {
            "cardinality": "many",
            "projection": {
              "attributes": {
                "type": "string"
              },
              "blocks": {
                "scope_entities": {
                  "cardinality": "single",
                  "projection": {
                    "attributes": {
                      "id": [
                        "list",
                        "number"
                      ]
                    },
                    "blocks": {},
                    "silently_ignored_attributes": []
                  }
                },
                "scope_group_member_entities": {
                  "cardinality": "single",
                  "projection": {
                    "attributes": {
                      "id": [
                        "list",
                        "number"
                      ]
                    },
                    "blocks": {},
                    "silently_ignored_attributes": []
                  }
                }
              },
              "silently_ignored_attributes": []
            }
          },
          "url_keyword_counts": {
            "cardinality": "single",
            "projection": {
              "attributes": {
                "retain_parent_keyword_count": "number",
                "retain_parent_url_count": "number",
                "total_keyword_count": "number",
                "total_url_count": "number"
              },
              "blocks": {},
              "silently_ignored_attributes": []
            }
          }
        },
        "silently_ignored_attributes": [
          "id"
        ]
      },
      "references": {},
      "renames": {},
      "sort_lists": [
        "urls"
      ],
      "split_csv": [],
      "type": "zia_url_categories"
    }
  ],
  "schema_version": 1,
  "source_files": [
    "zia/overrides/zia_traffic_forwarding_static_ip.json",
    "zia/overrides/zia_url_categories.json",
    "zia/pack.json",
    "zia/registry.json",
    "zia/schemas/provider/zia.json"
  ],
  "sources_sha256": "5074f5d3b480b578256e3906365398cde7024d85a19a87380b8f232044d07cb2"
}
